{
  "$schema": "http://json-schema.org/draft-07/schema#",
  "$id": "certificates.schema.json",

  "title": "الشهادات",
  "type": "array",
  "items": {
    "type": "object",
    "properties": {
      "name": {
        "type": "string",
        "description": "اسم الشهادة"
      },
      "id": {
        "type": "string",
        "description": "معرّف الشهادة"
      },
      "image": {
        "type": "string",
        "description": "رابط الصورة أو مسارها"
      },
      "link": {
        "type": "string",
        "format": "uri",
        "description": "رابط إلى الشهادة"
      },
      "provider": {
        "type": "object",
        "properties": {
          "name": {
            "type": "string",
            "description": "اسم الجهة المصدرة"
          },
          "link": {
            "type": "string",
            "format": "uri",
            "description": "رابط إلى الجهة المصدرة"
          },
          "icon": {
            "type": "string",
            "pattern": "^[a-z0-9]+(?:[-_][a-z0-9]+)*:[a-z0-9]+(?:[-_][a-z0-9]+)*$",
            "description": "معرّف Iconify صالح لجهة إصدار الشهادة"
          }
        },
        "required": ["name", "link", "icon"],
        "additionalProperties": false,
        "description": "معلومات الجهة المصدرة للشهادة"
      }
    },
    "required": ["name", "id", "image", "link", "provider"],
    "additionalProperties": false
  }
}
