[
  {
    "name": "خوارزميات وهياكل بيانات JavaScript",
    "id": "",
    "image": "/img/cert/javascript-algorithms-and-data-structures.png",
    "link": "https://freecodecamp.org/certification/Assayyaad/javascript-algorithms-and-data-structures",
    "provider": {
      "name": "FreeCodeCamp",
      "link": "https://freecodecamp.org",
      "icon": "simple-icons:freecodecamp"
    }
  },
  {
    "name": "مقدمة في C#",
    "id": "CC-KQMDTAMA",
    "image": "/img/cert/introduction-to-csharp.png",
    "link": "https://www.sololearn.com/en/certificates/CC-KQMDTAMA",
    "provider": {
      "name": "Sololearn",
      "link": "https://sololearn.com",
      "icon": "simple-icons:sololearn"
    }
  },
  {
    "name": "مقدمة في JavaScript",
    "id": "CC-7A1QGUWT",
    "image": "/img/cert/introduction-to-javascript.png",
    "link": "https://www.sololearn.com/en/certificates/CC-7A1QGUWT",
    "provider": {
      "name": "Sololearn",
      "link": "https://sololearn.com",
      "icon": "simple-icons:sololearn"
    }
  },
  {
    "name": "مقدمة في C++",
    "id": "CT-DKF29HTQ",
    "image": "/img/cert/cplusplus.png",
    "link": "https://www.sololearn.com/en/certificates/CT-DKF29HTQ",
    "provider": {
      "name": "Sololearn",
      "link": "https://sololearn.com",
      "icon": "simple-icons:sololearn"
    }
  },
  {
    "name": "التقنية للجميع",
    "id": "CC-49YAACNH",
    "image": "/img/cert/tech-for-everyone.png",
    "link": "https://api2.sololearn.com/v2/certificates/CC-49YAACNH/image/png",
    "provider": {
      "name": "Sololearn",
      "link": "https://sololearn.com",
      "icon": "simple-icons:sololearn"
    }
  }
]
